Tweet,Tweet_Normalized,Tweet_Tokenized,Tweet_Stopwords,Tweet_Stemmed,Suicide
"saya akan bunuh diri akhir pekan ini, saya tidak melihat alasan untuk tetap hidup, tidak ada yang cukup berubah untuk membuat saya ingin tinggal, saya diperkosa sebagai seorang anak dan sekarang semua yang saya bagi orang adalah objek seks yang baik, selamat tinggal semuanya","saya akan bunuh diri diri akhir pekan ini, saya tidak melihat alasan untuk tetap hidup, tidak ada yang cukup berubah untuk membuat saya ingin tinggal, saya diperkosa sebagai seorang anak dan sekarang semua yang saya bagi orang adalah objek seks yang baik, selamat tinggal semuanya","['saya', 'akan', 'bunuh', 'diri', 'diri', 'akhir', 'pekan', 'ini', ',', 'saya', 'tidak', 'melihat', 'alasan', 'untuk', 'tetap', 'hidup', ',', 'tidak', 'ada', 'yang', 'cukup', 'berubah', 'untuk', 'membuat', 'saya', 'ingin', 'tinggal', ',', 'saya', 'diperkosa', 'sebagai', 'seorang', 'anak', 'dan', 'sekarang', 'semua', 'yang', 'saya', 'bagi', 'orang', 'adalah', 'objek', 'seks', 'yang', 'baik', ',', 'selamat', 'tinggal', 'semuanya']","['bunuh', 'pekan', ',', 'alasan', 'hidup', ',', 'berubah', 'tinggal', ',', 'diperkosa', 'anak', 'orang', 'objek', 'seks', ',', 'selamat', 'tinggal']","['bunuh', 'pekan', '', 'alas', 'hidup', '', 'ubah', 'tinggal', '', 'perkosa', 'anak', 'orang', 'objek', 'seks', '', 'selamat', 'tinggal']",Potential Suicide post
naksir,naksir,['naksir'],['naksir'],['naksir'],Not Suicide post
"rt jika orang tidak ingin anda mati, anda bahkan dapat mengklaim benar -benar hidup","rt jika orang tidak ingin anda mati, anda bahkan dapat mengklaim benar -benar hidup","['rt', 'jika', 'orang', 'tidak', 'ingin', 'anda', 'mati', ',', 'anda', 'bahkan', 'dapat', 'mengklaim', 'benar', '-benar', 'hidup']","['rt', 'orang', 'mati', ',', 'mengklaim', '-benar', 'hidup']","['rt', 'orang', 'mati', '', 'klaim', '-benar', 'hidup']",Potential Suicide post
saya ingin menjadi pengusaha di futur,saya ingin menjadi pengusaha di futur,"['saya', 'ingin', 'menjadi', 'pengusaha', 'di', 'futur']","['pengusaha', 'futur']","['usaha', 'futur']",Not Suicide post
mafumafu oh sh it oh g od berebut untuk mendapatkan semua yang tidak dia bungkus,mafumafu oh sh it oh g od berebut untuk mendapatkan semua yang tidak dia bungkus,"['mafumafu', 'oh', 'sh', 'it', 'oh', 'g', 'od', 'berebut', 'untuk', 'mendapatkan', 'semua', 'yang', 'tidak', 'dia', 'bungkus']","['mafumafu', 'oh', 'sh', 'it', 'oh', 'g', 'od', 'berebut', 'bungkus']","['mafumafu', 'oh', 'sh', 'it', 'oh', 'g', 'od', 'rebut', 'bungkus']",Potential Suicide post
ya masih dingin di sini juga tapi s berpose untuk kembali ke suhu normal minggu ini akan menghabiskan waktu bersama para gadis minggu ini,ya masih dingin di sini juga tapi s berpose untuk kembali ke suhu normal minggu ini akan menghabiskan waktu bersama para gadis minggu ini,"['ya', 'masih', 'dingin', 'di', 'sini', 'juga', 'tapi', 's', 'berpose', 'untuk', 'kembali', 'ke', 'suhu', 'normal', 'minggu', 'ini', 'akan', 'menghabiskan', 'waktu', 'bersama', 'para', 'gadis', 'minggu', 'ini']","['ya', 'dingin', 's', 'berpose', 'suhu', 'normal', 'minggu', 'menghabiskan', 'gadis', 'minggu']","['ya', 'dingin', 's', 'pose', 'suhu', 'normal', 'minggu', 'habis', 'gadis', 'minggu']",Not Suicide post
selasa di kota besar hanover apa yang bisa lebih baik,selasa di kota besar hanover apa yang bisa lebih baik,"['selasa', 'di', 'kota', 'besar', 'hanover', 'apa', 'yang', 'bisa', 'lebih', 'baik']","['selasa', 'kota', 'hanover']","['selasa', 'kota', 'hanover']",Not Suicide post
hidup yang panjang,hidup yang panjang,"['hidup', 'yang', 'panjang']",['hidup'],['hidup'],Not Suicide post
rt saya tahu anda pikir anda sedih karena para koboi tidak bermain hari ini tetapi setiap hari tim anda tidak bisa kalah adalah kesempatan yang layak dirayakan,rt saya tahu anda pikir anda sedih karena para koboi tidak bermain hari ini tetapi setiap hari tim anda tidak bisa kalah adalah kesempatan yang layak dirayakan,"['rt', 'saya', 'tahu', 'anda', 'pikir', 'anda', 'sedih', 'karena', 'para', 'koboi', 'tidak', 'bermain', 'hari', 'ini', 'tetapi', 'setiap', 'hari', 'tim', 'anda', 'tidak', 'bisa', 'kalah', 'adalah', 'kesempatan', 'yang', 'layak', 'dirayakan']","['rt', 'pikir', 'sedih', 'koboi', 'bermain', 'tim', 'kalah', 'kesempatan', 'layak', 'dirayakan']","['rt', 'pikir', 'sedih', 'koboi', 'main', 'tim', 'kalah', 'sempat', 'layak', 'raya']",Not Suicide post
saya bertambah berat badan saya adalah salah satu dari orang -orang yang dibenci semua orang yang bisa menurunkan berat badan dengan diet kue dan kue,saya bertambah berat badan saya adalah salah satu dari orang -orang yang dibenci semua orang yang bisa menurunkan berat badan dengan diet kue dan kue,"['saya', 'bertambah', 'berat', 'badan', 'saya', 'adalah', 'salah', 'satu', 'dari', 'orang', '-orang', 'yang', 'dibenci', 'semua', 'orang', 'yang', 'bisa', 'menurunkan', 'berat', 'badan', 'dengan', 'diet', 'kue', 'dan', 'kue']","['bertambah', 'berat', 'badan', 'salah', 'orang', '-orang', 'dibenci', 'orang', 'menurunkan', 'berat', 'badan', 'diet', 'kue', 'kue']","['tambah', 'berat', 'badan', 'salah', 'orang', '-orang', 'benci', 'orang', 'turun', 'berat', 'badan', 'diet', 'kue', 'kue']",Not Suicide post
bayi saya lelah sekarang,bayi saya lelah sekarang,"['bayi', 'saya', 'lelah', 'sekarang']","['bayi', 'lelah']","['bayi', 'lelah']",Not Suicide post
"pasta gigi jika anda menggunakan barang pemutih, pemutih akan membakar lapisan kulit","pasta gigi jika anda menggunakan barang pemutih, pemutih akan membakar lapisan kulit","['pasta', 'gigi', 'jika', 'anda', 'menggunakan', 'barang', 'pemutih', ',', 'pemutih', 'akan', 'membakar', 'lapisan', 'kulit']","['pasta', 'gigi', 'barang', 'pemutih', ',', 'pemutih', 'membakar', 'lapisan', 'kulit']","['pasta', 'gigi', 'barang', 'mutih', '', 'mutih', 'bakar', 'lapis', 'kulit']",Not Suicide post
"pertama, terima kasih kedua adalah pelari layang -layang secara historis","pertama, terima kasih kedua adalah pelari layang -layang secara historis","['pertama', ',', 'terima', 'kasih', 'kedua', 'adalah', 'pelari', 'layang', '-layang', 'secara', 'historis']","[',', 'terima', 'kasih', 'pelari', 'layang', '-layang', 'historis']","['', 'terima', 'kasih', 'lari', 'layang', '-layang', 'historis']",Not Suicide post
ini menyebalkan saya benar -benar tidak tahu apa yang akan saya lakukan lagi keputusan ruam setelah keputusan ruam tidak ada kendali,ini menyebalkan saya benar -benar tidak tahu apa yang akan saya lakukan lagi keputusan ruam setelah keputusan ruam tidak ada kendali,"['ini', 'menyebalkan', 'saya', 'benar', '-benar', 'tidak', 'tahu', 'apa', 'yang', 'akan', 'saya', 'lakukan', 'lagi', 'keputusan', 'ruam', 'setelah', 'keputusan', 'ruam', 'tidak', 'ada', 'kendali']","['menyebalkan', '-benar', 'lakukan', 'keputusan', 'ruam', 'keputusan', 'ruam', 'kendali']","['sebal', '-benar', 'laku', 'putus', 'ruam', 'putus', 'ruam', 'kendali']",Potential Suicide post
"i am just a mess i ran out of meds and i havent had the strength or energy to go refill them i went to class today and ended up sitting on a sidewalk ugly crying and making people think i am a fucking headcase all i do is sleep and i never feel rested i m alone in a new town and i have no friends and all i want is someone to sit with me and talk a while i am hanging in there because i brought my cats here to this strange place and i cant just leave them to pikir mereka telah ditinggalkan, saya hanya tidur siang tiga jam dan yang saya dapatkan adalah sakit kepala dan masih lelah, saya tidak memiliki cucian yang bersih, kamar saya adalah clusterfuck yang saya belum menyisir rambut saya dalam beberapa hari atau dimakan dan alih -alih melakukan hal -hal yang perlu dihentikan di sini untuk menghindari pemikiran yang merugikan diri sendiri dan buruk dan saya tidak bisa mendapatkan diri saya untuk menghentikannya untuk menghindari hal -hal yang merugikan diri sendiri yang mengganggu dan mengerikan dan mengerikan dan saya tidak bisa mendapatkan diri saya untuk menghentikannya untuk menghindari merugikan diri sendiri yang merugikan, dan mengerikan dan mengerikan dan saya tidak bisa mendapatkan diri saya untuk berhenti di sini mencoba untuk menghindari kerusakan swadaya yang mengganggu dan buruk dan mengerikan dan saya tidak bisa mendapatkan diri saya untuk berhenti di sini mencoba untuk menghindari kerusakan swadaya yang mengganggu dan mengerikan dan mengerikan dan saya tidak bisa mendapatkan diri saya untuk menghentikannya untuk menghindari merugikan diri sendiri yang mengganggu amlazy dan awful dan awful dan get get get get my foning her","i am just a mess i ran out of meds and i havent had the strength or energy to go refill them i went to class today and ended up sitting on a sidewalk ugly crying and making people think i am a fucking headcase all i do is sleep and i never feel rested i m alone in a new town and i have no friends and all i want is someone to sit with me and talk a while i am hanging in there because i brought my cats here to this strange place and i cant just leave them to pikir mereka telah ditinggalkan, saya hanya tidur siang tiga jam dan yang saya dapatkan adalah sakit kepala dan masih lelah, saya tidak memiliki cucian yang bersih, kamar saya adalah clusterfuck yang saya belum menyisir rambut saya dalam beberapa hari atau dimakan dan alih -alih melakukan hal -hal yang perlu dihentikan di sini untuk menghindari pemikiran yang merugikan diri sendiri dan buruk dan saya tidak bisa mendapatkan diri saya untuk menghentikannya untuk menghindari hal -hal yang merugikan diri sendiri yang mengganggu dan mengerikan dan mengerikan dan saya tidak bisa mendapatkan diri saya untuk menghentikannya untuk menghindari merugikan diri sendiri yang merugikan, dan mengerikan dan mengerikan dan saya tidak bisa mendapatkan diri saya untuk berhenti di sini mencoba untuk menghindari kerusakan swadaya yang mengganggu dan buruk dan mengerikan dan saya tidak bisa mendapatkan diri saya untuk berhenti di sini mencoba untuk menghindari kerusakan swadaya yang mengganggu dan mengerikan dan mengerikan dan saya tidak bisa mendapatkan diri saya untuk menghentikannya untuk menghindari merugikan diri sendiri yang mengganggu amlazy dan awful dan awful dan get get get get my foning her","['i', 'am', 'just', 'a', 'mess', 'i', 'ran', 'out', 'of', 'meds', 'and', 'i', 'havent', 'had', 'the', 'strength', 'or', 'energy', 'to', 'go', 'refill', 'them', 'i', 'went', 'to', 'class', 'today', 'and', 'ended', 'up', 'sitting', 'on', 'a', 'sidewalk', 'ugly', 'crying', 'and', 'making', 'people', 'think', 'i', 'am', 'a', 'fucking', 'headcase', 'all', 'i', 'do', 'is', 'sleep', 'and', 'i', 'never', 'feel', 'rested', 'i', 'm', 'alone', 'in', 'a', 'new', 'town', 'and', 'i', 'have', 'no', 'friends', 'and', 'all', 'i', 'want', 'is', 'someone', 'to', 'sit', 'with', 'me', 'and', 'talk', 'a', 'while', 'i', 'am', 'hanging', 'in', 'there', 'because', 'i', 'brought', 'my', 'cats', 'here', 'to', 'this', 'strange', 'place', 'and', 'i', 'cant', 'just', 'leave', 'them', 'to', 'pikir', 'mereka', 'telah', 'ditinggalkan', ',', 'saya', 'hanya', 'tidur', 'siang', 'tiga', 'jam', 'dan', 'yang', 'saya', 'dapatkan', 'adalah', 'sakit', 'kepala', 'dan', 'masih', 'lelah', ',', 'saya', 'tidak', 'memiliki', 'cucian', 'yang', 'bersih', ',', 'kamar', 'saya', 'adalah', 'clusterfuck', 'yang', 'saya', 'belum', 'menyisir', 'rambut', 'saya', 'dalam', 'beberapa', 'hari', 'atau', 'dimakan', 'dan', 'alih', '-alih', 'melakukan', 'hal', '-hal', 'yang', 'perlu', 'dihentikan', 'di', 'sini', 'untuk', 'menghindari', 'pemikiran', 'yang', 'merugikan', 'diri', 'sendiri', 'dan', 'buruk', 'dan', 'saya', 'tidak', 'bisa', 'mendapatkan', 'diri', 'saya', 'untuk', 'menghentikannya', 'untuk', 'menghindari', 'hal', '-hal', 'yang', 'merugikan', 'diri', 'sendiri', 'yang', 'mengganggu', 'dan', 'mengerikan', 'dan', 'mengerikan', 'dan', 'saya', 'tidak', 'bisa', 'mendapatkan', 'diri', 'saya', 'untuk', 'menghentikannya', 'untuk', 'menghindari', 'merugikan', 'diri', 'sendiri', 'yang', 'merugikan', ',', 'dan', 'mengerikan', 'dan', 'mengerikan', 'dan', 'saya', 'tidak', 'bisa', 'mendapatkan', 'diri', 'saya', 'untuk', 'berhenti', 'di', 'sini', 'mencoba', 'untuk', 'menghindari', 'kerusakan', 'swadaya', 'yang', 'mengganggu', 'dan', 'buruk', 'dan', 'mengerikan', 'dan', 'saya', 'tidak', 'bisa', 'mendapatkan', 'diri', 'saya', 'untuk', 'berhenti', 'di', 'sini', 'mencoba', 'untuk', 'menghindari', 'kerusakan', 'swadaya', 'yang', 'mengganggu', 'dan', 'mengerikan', 'dan', 'mengerikan', 'dan', 'saya', 'tidak', 'bisa', 'mendapatkan', 'diri', 'saya', 'untuk', 'menghentikannya', 'untuk', 'menghindari', 'merugikan', 'diri', 'sendiri', 'yang', 'mengganggu', 'amlazy', 'dan', 'awful', 'dan', 'awful', 'dan', 'get', 'get', 'get', 'get', 'my', 'foning', 'her']","['i', 'am', 'just', 'a', 'mess', 'i', 'ran', 'out', 'of', 'meds', 'and', 'i', 'havent', 'had', 'the', 'strength', 'or', 'energy', 'to', 'go', 'refill', 'them', 'i', 'went', 'to', 'class', 'today', 'and', 'ended', 'up', 'sitting', 'on', 'a', 'sidewalk', 'ugly', 'crying', 'and', 'making', 'people', 'think', 'i', 'am', 'a', 'fucking', 'headcase', 'all', 'i', 'do', 'is', 'sleep', 'and', 'i', 'never', 'feel', 'rested', 'i', 'm', 'alone', 'in', 'a', 'new', 'town', 'and', 'i', 'have', 'no', 'friends', 'and', 'all', 'i', 'want', 'is', 'someone', 'to', 'sit', 'with', 'me', 'and', 'talk', 'a', 'while', 'i', 'am', 'hanging', 'in', 'there', 'because', 'i', 'brought', 'my', 'cats', 'here', 'to', 'this', 'strange', 'place', 'and', 'i', 'cant', 'just', 'leave', 'them', 'to', 'pikir', 'ditinggalkan', ',', 'tidur', 'siang', 'jam', 'dapatkan', 'sakit', 'kepala', 'lelah', ',', 'memiliki', 'cucian', 'bersih', ',', 'kamar', 'clusterfuck', 'menyisir', 'rambut', 'dimakan', 'alih', '-alih', '-hal', 'dihentikan', 'menghindari', 'pemikiran', 'merugikan', 'buruk', 'menghentikannya', 'menghindari', '-hal', 'merugikan', 'mengganggu', 'mengerikan', 'mengerikan', 'menghentikannya', 'menghindari', 'merugikan', 'merugikan', ',', 'mengerikan', 'mengerikan', 'berhenti', 'mencoba', 'menghindari', 'kerusakan', 'swadaya', 'mengganggu', 'buruk', 'mengerikan', 'berhenti', 'mencoba', 'menghindari', 'kerusakan', 'swadaya', 'mengganggu', 'mengerikan', 'mengerikan', 'menghentikannya', 'menghindari', 'merugikan', 'mengganggu', 'amlazy', 'awful', 'awful', 'get', 'get', 'get', 'get', 'my', 'foning', 'her']","['i', 'am', 'just', 'a', 'mess', 'i', 'ran', 'out', 'of', 'meds', 'and', 'i', 'havent', 'had', 'the', 'strength', 'or', 'energy', 'to', 'go', 'refill', 'them', 'i', 'went', 'to', 'class', 'today', 'and', 'ended', 'up', 'sitting', 'on', 'a', 'sidewalk', 'ugly', 'crying', 'and', 'making', 'people', 'think', 'i', 'am', 'a', 'fucking', 'headcase', 'all', 'i', 'do', 'is', 'sleep', 'and', 'i', 'never', 'feel', 'rested', 'i', 'm', 'alone', 'in', 'a', 'new', 'town', 'and', 'i', 'have', 'no', 'friends', 'and', 'all', 'i', 'want', 'is', 'someone', 'to', 'sit', 'with', 'me', 'and', 'talk', 'a', 'while', 'i', 'am', 'hanging', 'in', 'there', 'because', 'i', 'brought', 'my', 'cats', 'here', 'to', 'this', 'strange', 'place', 'and', 'i', 'cant', 'just', 'leave', 'them', 'to', 'pikir', 'tinggal', '', 'tidur', 'siang', 'jam', 'dapat', 'sakit', 'kepala', 'lelah', '', 'milik', 'cuci', 'bersih', '', 'kamar', 'clusterfuck', 'sisir', 'rambut', 'makan', 'alih', '-alih', '-hal', 'henti', 'hindar', 'pikir', 'rugi', 'buruk', 'henti', 'hindar', '-hal', 'rugi', 'ganggu', 'keri', 'keri', 'henti', 'hindar', 'rugi', 'rugi', '', 'keri', 'keri', 'henti', 'coba', 'hindar', 'rusa', 'swadaya', 'ganggu', 'buruk', 'keri', 'henti', 'coba', 'hindar', 'rusa', 'swadaya', 'ganggu', 'keri', 'keri', 'henti', 'hindar', 'rugi', 'ganggu', 'amlazy', 'awful', 'awful', 'get', 'get', 'get', 'get', 'my', 'foning', 'her']",Potential Suicide post
pulang beruang beruang sore ini dengan mikeyj alton towers besok,pulang beruang beruang sore ini dengan mikeyj alton towers besok,"['pulang', 'beruang', 'beruang', 'sore', 'ini', 'dengan', 'mikeyj', 'alton', 'towers', 'besok']","['pulang', 'beruang', 'beruang', 'sore', 'mikeyj', 'alton', 'towers', 'besok']","['pulang', 'beruang', 'beruang', 'sore', 'mikeyj', 'alton', 'towers', 'besok']",Not Suicide post
saya streamed dua episode riverdale dan saya sangat membenci diri sendiri karena sekarang saya tidak punya data,saya streamed dua episode riverdale dan saya sangat membenci diri sendiri karena sekarang saya tidak punya data,"['saya', 'streamed', 'dua', 'episode', 'riverdale', 'dan', 'saya', 'sangat', 'membenci', 'diri', 'sendiri', 'karena', 'sekarang', 'saya', 'tidak', 'punya', 'data']","['streamed', 'episode', 'riverdale', 'membenci', 'data']","['streamed', 'episode', 'riverdale', 'benci', 'data']",Potential Suicide post
baik itu mengesankan baik spot 25 dan spot 26,baik itu mengesankan baik spot 25 dan spot 26,"['baik', 'itu', 'mengesankan', 'baik', 'spot', '25', 'dan', 'spot', '26']","['mengesankan', 'spot', '25', 'spot', '26']","['kesan', 'spot', '25', 'spot', '26']",Not Suicide post
saya sangat lelah hidup,saya sangat lelah hidup,"['saya', 'sangat', 'lelah', 'hidup']","['lelah', 'hidup']","['lelah', 'hidup']",Potential Suicide post
"sekarang saya harus pergi ke bank besok dan melihat apa yang terjadi, saya punya masalah sekitar 3 minggu yang lalu dengan bi","sekarang saya harus pergi ke bank besok dan melihat apa yang terjadi, saya punya masalah sekitar 3 minggu yang lalu dengan bi","['sekarang', 'saya', 'harus', 'pergi', 'ke', 'bank', 'besok', 'dan', 'melihat', 'apa', 'yang', 'terjadi', ',', 'saya', 'punya', 'masalah', 'sekitar', '3', 'minggu', 'yang', 'lalu', 'dengan', 'bi']","['pergi', 'bank', 'besok', ',', '3', 'minggu', 'bi']","['pergi', 'bank', 'besok', '', '3', 'minggu', 'bi']",Potential Suicide post
ya rak buku keren saya punya satu dengan berbagai buku yang disematkan ke dinding,ya rak buku keren saya punya satu dengan berbagai buku yang disematkan ke dinding,"['ya', 'rak', 'buku', 'keren', 'saya', 'punya', 'satu', 'dengan', 'berbagai', 'buku', 'yang', 'disematkan', 'ke', 'dinding']","['ya', 'rak', 'buku', 'keren', 'buku', 'disematkan', 'dinding']","['ya', 'rak', 'buku', 'keren', 'buku', 'semat', 'dinding']",Not Suicide post
cukup dari steker buku yang tidak tahu malu,cukup dari steker buku yang tidak tahu malu,"['cukup', 'dari', 'steker', 'buku', 'yang', 'tidak', 'tahu', 'malu']","['steker', 'buku', 'malu']","['steker', 'buku', 'malu']",Not Suicide post
,nan,['nan'],['nan'],['nan'],Potential Suicide post
mengapa saya tertarik begitu mudah ini adalah satu hal yang paling saya benci tentang diri saya yang paling saya akhirnya menjadi musuh terburuk saya sendiri sepanjang waktu,mengapa saya tertarik begitu mudah ini adalah satu hal yang paling saya benci tentang diri saya yang paling saya akhirnya menjadi musuh terburuk saya sendiri sepanjang waktu,"['mengapa', 'saya', 'tertarik', 'begitu', 'mudah', 'ini', 'adalah', 'satu', 'hal', 'yang', 'paling', 'saya', 'benci', 'tentang', 'diri', 'saya', 'yang', 'paling', 'saya', 'akhirnya', 'menjadi', 'musuh', 'terburuk', 'saya', 'sendiri', 'sepanjang', 'waktu']","['tertarik', 'mudah', 'benci', 'musuh', 'terburuk']","['tarik', 'mudah', 'benci', 'musuh', 'buruk']",Potential Suicide post
rt saya tidak ingin berada di sini lagi,rt saya tidak ingin berada di sini lagi,"['rt', 'saya', 'tidak', 'ingin', 'berada', 'di', 'sini', 'lagi']",['rt'],['rt'],Potential Suicide post
terima kasih tidak sabar untuk pulang kerja malam ini karena suatu alasan,terima kasih tidak sabar untuk pulang kerja malam ini karena suatu alasan,"['terima', 'kasih', 'tidak', 'sabar', 'untuk', 'pulang', 'kerja', 'malam', 'ini', 'karena', 'suatu', 'alasan']","['terima', 'kasih', 'sabar', 'pulang', 'kerja', 'malam', 'alasan']","['terima', 'kasih', 'sabar', 'pulang', 'kerja', 'malam', 'alas']",Not Suicide post
kebiasaan buruk lebih sulit diidentifikasi dalam kehidupan kerja anda,kebiasaan buruk lebih sulit diidentifikasi dalam kehidupan kerja anda,"['kebiasaan', 'buruk', 'lebih', 'sulit', 'diidentifikasi', 'dalam', 'kehidupan', 'kerja', 'anda']","['kebiasaan', 'buruk', 'sulit', 'diidentifikasi', 'kehidupan', 'kerja']","['biasa', 'buruk', 'sulit', 'identifikasi', 'hidup', 'kerja']",Not Suicide post
hampir berlibur di sisi lain berkemah d d d,hampir berlibur di sisi lain berkemah d d d,"['hampir', 'berlibur', 'di', 'sisi', 'lain', 'berkemah', 'd', 'd', 'd']","['berlibur', 'sisi', 'berkemah', 'd', 'd', 'd']","['libur', 'sisi', 'kemah', 'd', 'd', 'd']",Not Suicide post
bosan semuanya tidak sabar untuk mati,bosan semuanya tidak sabar untuk meninggal,"['bosan', 'semuanya', 'tidak', 'sabar', 'untuk', 'meninggal']","['bosan', 'sabar', 'meninggal']","['bosan', 'sabar', 'tinggal']",Potential Suicide post
"kecemasan kesehatan mendorong beberapa pemikiran buruk di kepala saya, saya telah berjuang selama 2 bulan sekarang dengan beberapa masalah kesehatan sebagai pria berusia 26 tahun yang sifat pesimis saya hanya membuat saya berpikir tentang yang terburuk tangan dan kaki saya saat ini kesemutan dan terbakar, saya terus membayangkan diri saya lebih suka hidup dengan soal -lifions yang sudah ada di masa depan dan seperti yang terjadi pada hari -hari bunuh diri yang datang ke dalam pikiran saya karena saya lebih suka saya lebih suka menemukan segalanya daripada mendadak dengan segala hal, dan seperti yang terjadi pada hari -hari bunuh diri karena saya lebih suka berpikiran seperti halnya ke depan dan seperti yang saya sukai dari waktu ke depan dan seperti yang saya sukai dan sebagaimana adanya. ini dan sekarang kesehatan saya gagal untuk pertama kalinya","kecemasan kesehatan mendorong beberapa pemikiran buruk di kepala saya, saya telah berjuang selama 2 bulan sekarang dengan beberapa masalah kesehatan sebagai pria berusia 26 tahun yang sifat pesimis saya hanya membuat saya berpikir tentang yang terburuk tangan dan kaki saya saat ini kesemutan dan terbakar, saya terus membayangkan diri saya lebih suka hidup dengan soal -lifions yang sudah ada di masa depan dan seperti yang terjadi pada hari -hari bunuh diri diri yang datang ke dalam pikiran saya karena saya lebih suka saya lebih suka menemukan segalanya daripada mendadak dengan segala hal, dan seperti yang terjadi pada hari -hari bunuh diri diri karena saya lebih suka berpikiran seperti halnya ke depan dan seperti yang saya sukai dari waktu ke depan dan seperti yang saya sukai dan sebagaimana adanya. ini dan sekarang kesehatan saya tidak berhasil untuk pertama kalinya","['kecemasan', 'kesehatan', 'mendorong', 'beberapa', 'pemikiran', 'buruk', 'di', 'kepala', 'saya', ',', 'saya', 'telah', 'berjuang', 'selama', '2', 'bulan', 'sekarang', 'dengan', 'beberapa', 'masalah', 'kesehatan', 'sebagai', 'pria', 'berusia', '26', 'tahun', 'yang', 'sifat', 'pesimis', 'saya', 'hanya', 'membuat', 'saya', 'berpikir', 'tentang', 'yang', 'terburuk', 'tangan', 'dan', 'kaki', 'saya', 'saat', 'ini', 'kesemutan', 'dan', 'terbakar', ',', 'saya', 'terus', 'membayangkan', 'diri', 'saya', 'lebih', 'suka', 'hidup', 'dengan', 'soal', '-lifions', 'yang', 'sudah', 'ada', 'di', 'masa', 'depan', 'dan', 'seperti', 'yang', 'terjadi', 'pada', 'hari', '-hari', 'bunuh', 'diri', 'diri', 'yang', 'datang', 'ke', 'dalam', 'pikiran', 'saya', 'karena', 'saya', 'lebih', 'suka', 'saya', 'lebih', 'suka', 'menemukan', 'segalanya', 'daripada', 'mendadak', 'dengan', 'segala', 'hal', ',', 'dan', 'seperti', 'yang', 'terjadi', 'pada', 'hari', '-hari', 'bunuh', 'diri', 'diri', 'karena', 'saya', 'lebih', 'suka', 'berpikiran', 'seperti', 'halnya', 'ke', 'depan', 'dan', 'seperti', 'yang', 'saya', 'sukai', 'dari', 'waktu', 'ke', 'depan', 'dan', 'seperti', 'yang', 'saya', 'sukai', 'dan', 'sebagaimana', 'adanya', '.', 'ini', 'dan', 'sekarang', 'kesehatan', 'saya', 'tidak', 'berhasil', 'untuk', 'pertama', 'kalinya']","['kecemasan', 'kesehatan', 'mendorong', 'pemikiran', 'buruk', 'kepala', ',', 'berjuang', '2', 'kesehatan', 'pria', 'berusia', '26', 'sifat', 'pesimis', 'berpikir', 'terburuk', 'tangan', 'kaki', 'kesemutan', 'terbakar', ',', 'membayangkan', 'suka', 'hidup', '-lifions', '-hari', 'bunuh', 'pikiran', 'suka', 'suka', 'menemukan', 'mendadak', ',', '-hari', 'bunuh', 'suka', 'berpikiran', 'halnya', 'sukai', 'sukai', '.', 'kesehatan', 'berhasil', 'kalinya']","['cemas', 'sehat', 'dorong', 'pikir', 'buruk', 'kepala', '', 'juang', '2', 'sehat', 'pria', 'usia', '26', 'sifat', 'pesimis', 'pikir', 'buruk', 'tangan', 'kaki', 'semut', 'bakar', '', 'bayang', 'suka', 'hidup', '-lifions', '-hari', 'bunuh', 'pikir', 'suka', 'suka', 'temu', 'dadak', '', '-hari', 'bunuh', 'suka', 'pikir', 'hal', 'suka', 'suka', '', 'sehat', 'hasil', 'kali']",Potential Suicide post
daniel menang,daniel menang,"['daniel', 'menang']","['daniel', 'menang']","['daniel', 'menang']",Potential Suicide post
seorang teman yang saya kenal online dari tadi malam akhirnya menambahkan saya di utusannya,seorang teman yang saya kenal online dari tadi malam akhirnya menambahkan saya di utusannya,"['seorang', 'teman', 'yang', 'saya', 'kenal', 'online', 'dari', 'tadi', 'malam', 'akhirnya', 'menambahkan', 'saya', 'di', 'utusannya']","['teman', 'kenal', 'online', 'malam', 'utusannya']","['teman', 'kenal', 'online', 'malam', 'utus']",Not Suicide post
leven scotland tidak ingin berada di sini lagi,leven scotland tidak ingin berada di sini lagi,"['leven', 'scotland', 'tidak', 'ingin', 'berada', 'di', 'sini', 'lagi']","['leven', 'scotland']","['leven', 'scotland']",Potential Suicide post
pernahkah anda melihat tautan ini saya pikir anda mungkin menyukainya,pernahkah anda melihat tautan ini saya pikir anda mungkin menyukainya,"['pernahkah', 'anda', 'melihat', 'tautan', 'ini', 'saya', 'pikir', 'anda', 'mungkin', 'menyukainya']","['pernahkah', 'tautan', 'pikir', 'menyukainya']","['pernah', 'taut', 'pikir', 'suka']",Not Suicide post
