Tweet,Tweet_Normalized,Tweet_Tokenized,Tweet_Stopwords,Tweet_Stemmed,Suicide
"hidup saya tidak ada artinya, saya hanya ingin mengakhiri hidup saya dengan sangat buruk hidup saya benar -benar kosong dan saya tidak ingin harus menciptakan makna di dalamnya menciptakan makna adalah rasa sakit berapa lama saya akan menahan keinginan untuk menjalankan kepala mobil saya terlebih dahulu ke orang berikutnya yang datang dengan cara yang berlawanan ketika saya akan berhenti dengan perasaan cemburu dengan karakter tragis seperti tiang gomer untuk swift end mereka bisa dibawa ke kehidupan mereka cemburu seperti gomer tiang untuk ujung swift yang mereka bisa bawa ke hidup mereka cemburu seperti gomer tiang untuk ujung swift yang mereka bisa bawa ke hidup mereka cemburu seperti gomer tiang untuk ujung swift mereka bisa dibawa ke hidup mereka cemburu seperti gomer tiang untuk swift end mereka bisa dibawa ke hidup mereka cemburu seperti gomer tiang untuk ujung swift mereka bisa dibawa ke hidup mereka cemburu seperti gomer tiang untuk ujung swift mereka bisa dibawa ke hidup mereka cembur","hidup saya tidak ada artinya, saya hanya ingin mengakhiri hidup saya dengan sangat buruk hidup saya benar -benar kosong dan saya tidak ingin harus menciptakan makna di dalamnya menciptakan makna adalah rasa sakit berapa lama saya akan menahan keinginan untuk menjalankan kepala mobil saya terlebih dahulu ke orang berikutnya yang datang dengan cara yang berlawanan ketika saya akan berhenti dengan perasaan cemburu dengan karakter tragis seperti tiang gomer untuk swift end mereka bisa dibawa ke kehidupan mereka cemburu seperti gomer tiang untuk ujung swift yang mereka bisa bawa ke hidup mereka cemburu seperti gomer tiang untuk ujung swift yang mereka bisa bawa ke hidup mereka cemburu seperti gomer tiang untuk ujung swift mereka bisa dibawa ke hidup mereka cemburu seperti gomer tiang untuk swift end mereka bisa dibawa ke hidup mereka cemburu seperti gomer tiang untuk ujung swift mereka bisa dibawa ke hidup mereka cemburu seperti gomer tiang untuk ujung swift mereka bisa dibawa ke hidup mereka cembur","['hidup', 'saya', 'tidak', 'ada', 'artinya', ',', 'saya', 'hanya', 'ingin', 'mengakhiri', 'hidup', 'saya', 'dengan', 'sangat', 'buruk', 'hidup', 'saya', 'benar', '-benar', 'kosong', 'dan', 'saya', 'tidak', 'ingin', 'harus', 'menciptakan', 'makna', 'di', 'dalamnya', 'menciptakan', 'makna', 'adalah', 'rasa', 'sakit', 'berapa', 'lama', 'saya', 'akan', 'menahan', 'keinginan', 'untuk', 'menjalankan', 'kepala', 'mobil', 'saya', 'terlebih', 'dahulu', 'ke', 'orang', 'berikutnya', 'yang', 'datang', 'dengan', 'cara', 'yang', 'berlawanan', 'ketika', 'saya', 'akan', 'berhenti', 'dengan', 'perasaan', 'cemburu', 'dengan', 'karakter', 'tragis', 'seperti', 'tiang', 'gomer', 'untuk', 'swift', 'end', 'mereka', 'bisa', 'dibawa', 'ke', 'kehidupan', 'mereka', 'cemburu', 'seperti', 'gomer', 'tiang', 'untuk', 'ujung', 'swift', 'yang', 'mereka', 'bisa', 'bawa', 'ke', 'hidup', 'mereka', 'cemburu', 'seperti', 'gomer', 'tiang', 'untuk', 'ujung', 'swift', 'yang', 'mereka', 'bisa', 'bawa', 'ke', 'hidup', 'mereka', 'cemburu', 'seperti', 'gomer', 'tiang', 'untuk', 'ujung', 'swift', 'mereka', 'bisa', 'dibawa', 'ke', 'hidup', 'mereka', 'cemburu', 'seperti', 'gomer', 'tiang', 'untuk', 'swift', 'end', 'mereka', 'bisa', 'dibawa', 'ke', 'hidup', 'mereka', 'cemburu', 'seperti', 'gomer', 'tiang', 'untuk', 'ujung', 'swift', 'mereka', 'bisa', 'dibawa', 'ke', 'hidup', 'mereka', 'cemburu', 'seperti', 'gomer', 'tiang', 'untuk', 'ujung', 'swift', 'mereka', 'bisa', 'dibawa', 'ke', 'hidup', 'mereka', 'cembur']","['hidup', ',', 'hidup', 'buruk', 'hidup', '-benar', 'kosong', 'menciptakan', 'makna', 'dalamnya', 'menciptakan', 'makna', 'sakit', 'menahan', 'menjalankan', 'kepala', 'mobil', 'orang', 'berlawanan', 'berhenti', 'perasaan', 'cemburu', 'karakter', 'tragis', 'tiang', 'gomer', 'swift', 'end', 'dibawa', 'kehidupan', 'cemburu', 'gomer', 'tiang', 'ujung', 'swift', 'bawa', 'hidup', 'cemburu', 'gomer', 'tiang', 'ujung', 'swift', 'bawa', 'hidup', 'cemburu', 'gomer', 'tiang', 'ujung', 'swift', 'dibawa', 'hidup', 'cemburu', 'gomer', 'tiang', 'swift', 'end', 'dibawa', 'hidup', 'cemburu', 'gomer', 'tiang', 'ujung', 'swift', 'dibawa', 'hidup', 'cemburu', 'gomer', 'tiang', 'ujung', 'swift', 'dibawa', 'hidup', 'cembur']","['hidup', '', 'hidup', 'buruk', 'hidup', '-benar', 'kosong', 'cipta', 'makna', 'dalam', 'cipta', 'makna', 'sakit', 'tahan', 'jalan', 'kepala', 'mobil', 'orang', 'lawan', 'henti', 'asa', 'cemburu', 'karakter', 'tragis', 'tiang', 'gomer', 'swift', 'end', 'bawa', 'hidup', 'cemburu', 'gomer', 'tiang', 'ujung', 'swift', 'bawa', 'hidup', 'cemburu', 'gomer', 'tiang', 'ujung', 'swift', 'bawa', 'hidup', 'cemburu', 'gomer', 'tiang', 'ujung', 'swift', 'bawa', 'hidup', 'cemburu', 'gomer', 'tiang', 'swift', 'end', 'bawa', 'hidup', 'cemburu', 'gomer', 'tiang', 'ujung', 'swift', 'bawa', 'hidup', 'cemburu', 'gomer', 'tiang', 'ujung', 'swift', 'bawa', 'hidup', 'cembur']",Potential Suicide post
rt hai tita sekarang saya tahu mengapa dia adalah yang paling rendah hati dan paling asli meskipun itu,rt hai tita sekarang saya tahu mengapa dia adalah yang paling rendah hati dan paling asli meskipun itu,"['rt', 'hai', 'tita', 'sekarang', 'saya', 'tahu', 'mengapa', 'dia', 'adalah', 'yang', 'paling', 'rendah', 'hati', 'dan', 'paling', 'asli', 'meskipun', 'itu']","['rt', 'hai', 'tita', 'rendah', 'hati', 'asli']","['rt', 'hai', 'tita', 'rendah', 'hati', 'asli']",Not Suicide post
kenapa aku benar -benar bisa memakukan pekerjaanku yang aku benci dengan sepenuh hati tetapi berhasil mengacau setiap si,kenapa saya benar -benar bisa memakukan pekerjaanku yang saya benci dengan sepenuh hati tetapi berhasil mengacau setiap si,"['kenapa', 'saya', 'benar', '-benar', 'bisa', 'memakukan', 'pekerjaanku', 'yang', 'saya', 'benci', 'dengan', 'sepenuh', 'hati', 'tetapi', 'berhasil', 'mengacau', 'setiap', 'si']","['-benar', 'memakukan', 'pekerjaanku', 'benci', 'sepenuh', 'hati', 'berhasil', 'mengacau', 'si']","['-benar', 'paku', 'kerja', 'benci', 'sepenuh', 'hati', 'hasil', 'acau', 'si']",Potential Suicide post
duduk di rumah tidak melakukan apa pun mencari foward untuk membuat roti minggu depan,duduk di rumah tidak melakukan apa pun mencari foward untuk membuat roti minggu depan,"['duduk', 'di', 'rumah', 'tidak', 'melakukan', 'apa', 'pun', 'mencari', 'foward', 'untuk', 'membuat', 'roti', 'minggu', 'depan']","['duduk', 'rumah', 'mencari', 'foward', 'roti', 'minggu']","['duduk', 'rumah', 'cari', 'foward', 'roti', 'minggu']",Not Suicide post
"saya menyukai ryder untuk sementara waktu dan senang melihatnya tampil di pertarungan televisi, saya menyukainya","saya menyukai ryder untuk sementara waktu dan senang melihatnya tampil di pertarungan televisi, saya menyukainya","['saya', 'menyukai', 'ryder', 'untuk', 'sementara', 'waktu', 'dan', 'senang', 'melihatnya', 'tampil', 'di', 'pertarungan', 'televisi', ',', 'saya', 'menyukainya']","['menyukai', 'ryder', 'senang', 'tampil', 'pertarungan', 'televisi', ',', 'menyukainya']","['suka', 'ryder', 'senang', 'tampil', 'tarung', 'televisi', '', 'suka']",Not Suicide post
haha jam 2 pagi lol omg saya membeku juga haha,haha jam 2 pagi tertawa ya tuhan saya membeku juga haha,"['haha', 'jam', '2', 'pagi', 'tertawa', 'ya', 'tuhan', 'saya', 'membeku', 'juga', 'haha']","['haha', 'jam', '2', 'pagi', 'tertawa', 'ya', 'tuhan', 'membeku', 'haha']","['haha', 'jam', '2', 'pagi', 'tertawa', 'ya', 'tuhan', 'beku', 'haha']",Not Suicide post
saya melihat foto anda panas,saya melihat foto anda panas,"['saya', 'melihat', 'foto', 'anda', 'panas']","['foto', 'panas']","['foto', 'panas']",Not Suicide post
"keren sekarang saya memiliki musik tema lompatan saya sendiri, saya akan lego memikirkan fakta bahwa itu adalah musik pepe le pew dan hanya melompat","keren sekarang saya memiliki musik tema lompatan saya sendiri, saya akan lego memikirkan fakta bahwa itu adalah musik pepe le pew dan hanya melompat","['keren', 'sekarang', 'saya', 'memiliki', 'musik', 'tema', 'lompatan', 'saya', 'sendiri', ',', 'saya', 'akan', 'lego', 'memikirkan', 'fakta', 'bahwa', 'itu', 'adalah', 'musik', 'pepe', 'le', 'pew', 'dan', 'hanya', 'melompat']","['keren', 'memiliki', 'musik', 'tema', 'lompatan', ',', 'lego', 'memikirkan', 'fakta', 'musik', 'pepe', 'le', 'pew', 'melompat']","['keren', 'milik', 'musik', 'tema', 'lompat', '', 'lego', 'pikir', 'fakta', 'musik', 'pepe', 'le', 'pew', 'lompat']",Not Suicide post
tentang waktu mc flipside mix keluar,tentang waktu mc flipside mix keluar,"['tentang', 'waktu', 'mc', 'flipside', 'mix', 'keluar']","['mc', 'flipside', 'mix']","['mc', 'flipside', 'mix']",Not Suicide post
"dengan situasi keuangan saya semakin buruk, jadi apakah bunuh diri kesehatan mental saya adalah rencana saya z dan saya merasa seperti akan mencapai rencana z, saya pikir saya seharusnya hanya melakukan bunuh diri pada usia 15 tahun ketika saya banyak memikirkannya sekarang saya tumbuh dan saya membuat hidup saya lebih buruk","dengan situasi keuangan saya semakin buruk, jadi apakah bunuh diri diri kesehatan mental saya adalah rencana saya z dan saya merasa seperti akan mencapai rencana z, saya pikir saya seharusnya hanya melakukan bunuh diri diri pada usia 15 tahun ketika saya banyak memikirkannya sekarang saya tumbuh dan saya membuat hidup saya lebih buruk","['dengan', 'situasi', 'keuangan', 'saya', 'semakin', 'buruk', ',', 'jadi', 'apakah', 'bunuh', 'diri', 'diri', 'kesehatan', 'mental', 'saya', 'adalah', 'rencana', 'saya', 'z', 'dan', 'saya', 'merasa', 'seperti', 'akan', 'mencapai', 'rencana', 'z', ',', 'saya', 'pikir', 'saya', 'seharusnya', 'hanya', 'melakukan', 'bunuh', 'diri', 'diri', 'pada', 'usia', '15', 'tahun', 'ketika', 'saya', 'banyak', 'memikirkannya', 'sekarang', 'saya', 'tumbuh', 'dan', 'saya', 'membuat', 'hidup', 'saya', 'lebih', 'buruk']","['situasi', 'keuangan', 'buruk', ',', 'bunuh', 'kesehatan', 'mental', 'rencana', 'z', 'mencapai', 'rencana', 'z', ',', 'pikir', 'bunuh', 'usia', '15', 'memikirkannya', 'tumbuh', 'hidup', 'buruk']","['situasi', 'uang', 'buruk', '', 'bunuh', 'sehat', 'mental', 'rencana', 'z', 'capai', 'rencana', 'z', '', 'pikir', 'bunuh', 'usia', '15', 'pikir', 'tumbuh', 'hidup', 'buruk']",Potential Suicide post
setiap hari menjadi kekecewaan bagi kita orang amerika yang menginginkan amerika kita kembali seperti l,setiap hari menjadi kekecewaan bagi kita orang amerika yang menginginkan amerika kita kembali seperti l,"['setiap', 'hari', 'menjadi', 'kekecewaan', 'bagi', 'kita', 'orang', 'amerika', 'yang', 'menginginkan', 'amerika', 'kita', 'kembali', 'seperti', 'l']","['kekecewaan', 'orang', 'amerika', 'amerika', 'l']","['kecewa', 'orang', 'amerika', 'amerika', 'l']",Potential Suicide post
rt saya mendukung ini,rt saya mendukung ini,"['rt', 'saya', 'mendukung', 'ini']","['rt', 'mendukung']","['rt', 'dukung']",Not Suicide post
saya hanya bosan dengan semua yang saya ingin mati,saya hanya bosan dengan semua yang saya ingin meninggal,"['saya', 'hanya', 'bosan', 'dengan', 'semua', 'yang', 'saya', 'ingin', 'meninggal']","['bosan', 'meninggal']","['bosan', 'tinggal']",Potential Suicide post
rt seberapa besar kemarahan yang harus anda bawa untuk memperlakukan orang asing yang berjuang melawan kehidupan anda,rt seberapa besar kemarahan yang harus anda bawa untuk memperlakukan orang asing yang berjuang melawan kehidupan anda,"['rt', 'seberapa', 'besar', 'kemarahan', 'yang', 'harus', 'anda', 'bawa', 'untuk', 'memperlakukan', 'orang', 'asing', 'yang', 'berjuang', 'melawan', 'kehidupan', 'anda']","['rt', 'kemarahan', 'bawa', 'memperlakukan', 'orang', 'asing', 'berjuang', 'melawan', 'kehidupan']","['rt', 'marah', 'bawa', 'laku', 'orang', 'asing', 'juang', 'lawan', 'hidup']",Potential Suicide post
"berdoa untuk pekerjaan karir barunya, puji tuhan, saya mendapat pekerjaan baru","berdoa untuk pekerjaan karir barunya, puji tuhan, saya mendapat pekerjaan baru","['berdoa', 'untuk', 'pekerjaan', 'karir', 'barunya', ',', 'puji', 'tuhan', ',', 'saya', 'mendapat', 'pekerjaan', 'baru']","['berdoa', 'pekerjaan', 'karir', 'barunya', ',', 'puji', 'tuhan', ',', 'pekerjaan']","['doa', 'kerja', 'karir', 'baru', '', 'puji', 'tuhan', '', 'kerja']",Not Suicide post
hooraaaaaaaaay bangga telah menjadi tetesan kecil dalam ucapan selamat ini,hooraaaaaaaaay bangga telah menjadi tetesan kecil dalam ucapan selamat ini,"['hooraaaaaaaaay', 'bangga', 'telah', 'menjadi', 'tetesan', 'kecil', 'dalam', 'ucapan', 'selamat', 'ini']","['hooraaaaaaaaay', 'bangga', 'tetesan', 'ucapan', 'selamat']","['hooraaaaaaaaay', 'bangga', 'tetes', 'ucap', 'selamat']",Not Suicide post
rt lepaskan tubuh saya,rt lepaskan tubuh saya,"['rt', 'lepaskan', 'tubuh', 'saya']","['rt', 'lepaskan', 'tubuh']","['rt', 'lepas', 'tubuh']",Potential Suicide post
rt saya bersumpah beberapa bajingan ingin orang menjadi pedofil homofobik rasis yang mengerikan setelah mereka mati dan anda gi,rt saya bersumpah beberapa bajingan ingin orang menjadi pedofil homofobik rasis yang mengerikan setelah mereka meninggal dan anda gi,"['rt', 'saya', 'bersumpah', 'beberapa', 'bajingan', 'ingin', 'orang', 'menjadi', 'pedofil', 'homofobik', 'rasis', 'yang', 'mengerikan', 'setelah', 'mereka', 'meninggal', 'dan', 'anda', 'gi']","['rt', 'bersumpah', 'bajingan', 'orang', 'pedofil', 'homofobik', 'rasis', 'mengerikan', 'meninggal', 'gi']","['rt', 'sumpah', 'bajing', 'orang', 'pedofil', 'homofobik', 'ras', 'keri', 'tinggal', 'gi']",Potential Suicide post
saya selamat ulang tahun mencintai foxy avatar pic dan rencana pesta serius untuk hari besar,saya selamat ulang tahun mencintai foxy avatar pic dan rencana pesta serius untuk hari besar,"['saya', 'selamat', 'ulang', 'tahun', 'mencintai', 'foxy', 'avatar', 'pic', 'dan', 'rencana', 'pesta', 'serius', 'untuk', 'hari', 'besar']","['selamat', 'ulang', 'mencintai', 'foxy', 'avatar', 'pic', 'rencana', 'pesta', 'serius']","['selamat', 'ulang', 'cinta', 'foxy', 'avatar', 'pic', 'rencana', 'pesta', 'serius']",Not Suicide post
"saya melakukan sesuatu pada tanggal 2 oktober saya overdosis saya hanya merasa begitu sendirian dan mengerikan saya berada di rumah sakit selama dua hari sekarang ketika saya berjalan di lorong -lorong sekolah saya, mereka selalu menatap saya dengan aneh dan mengatakan saya harus minum lebih banyak pil dan saya benci lagi, saya tidak memiliki siapa pun yang memiliki suara ini di kepala saya sekarang dan tidak akan hilang dan saya tidak bisa menjadi diri saya sendiri untuk membaca untuk membaca","saya melakukan sesuatu pada tanggal 2 oktober saya overdosis saya hanya merasa begitu sendiri dan mengerikan saya berada di rumah sakit selama dua hari sekarang ketika saya berjalan di lorong -lorong sekolah saya, mereka selalu menatap saya dengan aneh dan mengatakan saya harus minum lebih banyak pil dan saya benci lagi, saya tidak memiliki siapa pun yang memiliki suara ini di kepala saya sekarang dan tidak akan hilang dan saya tidak bisa menjadi diri saya sendiri untuk membaca untuk membaca","['saya', 'melakukan', 'sesuatu', 'pada', 'tanggal', '2', 'oktober', 'saya', 'overdosis', 'saya', 'hanya', 'merasa', 'begitu', 'sendiri', 'dan', 'mengerikan', 'saya', 'berada', 'di', 'rumah', 'sakit', 'selama', 'dua', 'hari', 'sekarang', 'ketika', 'saya', 'berjalan', 'di', 'lorong', '-lorong', 'sekolah', 'saya', ',', 'mereka', 'selalu', 'menatap', 'saya', 'dengan', 'aneh', 'dan', 'mengatakan', 'saya', 'harus', 'minum', 'lebih', 'banyak', 'pil', 'dan', 'saya', 'benci', 'lagi', ',', 'saya', 'tidak', 'memiliki', 'siapa', 'pun', 'yang', 'memiliki', 'suara', 'ini', 'di', 'kepala', 'saya', 'sekarang', 'dan', 'tidak', 'akan', 'hilang', 'dan', 'saya', 'tidak', 'bisa', 'menjadi', 'diri', 'saya', 'sendiri', 'untuk', 'membaca', 'untuk', 'membaca']","['tanggal', '2', 'oktober', 'overdosis', 'mengerikan', 'rumah', 'sakit', 'berjalan', 'lorong', '-lorong', 'sekolah', ',', 'menatap', 'aneh', 'minum', 'pil', 'benci', ',', 'memiliki', 'memiliki', 'suara', 'kepala', 'hilang', 'membaca', 'membaca']","['tanggal', '2', 'oktober', 'overdosis', 'keri', 'rumah', 'sakit', 'jalan', 'lorong', '-lorong', 'sekolah', '', 'tatap', 'aneh', 'minum', 'pil', 'benci', '', 'milik', 'milik', 'suara', 'kepala', 'hilang', 'baca', 'baca']",Potential Suicide post
hukum besar membunuh suamiku surat terbuka dari janda mitra sidley,hukum besar membunuh suamiku surat terbuka dari janda mitra sidley,"['hukum', 'besar', 'membunuh', 'suamiku', 'surat', 'terbuka', 'dari', 'janda', 'mitra', 'sidley']","['hukum', 'membunuh', 'suamiku', 'surat', 'terbuka', 'janda', 'mitra', 'sidley']","['hukum', 'bunuh', 'suami', 'surat', 'buka', 'janda', 'mitra', 'sidley']",Potential Suicide post
kita semua dapat bersenang -senang wanita malam yang bisa bergabung dengan siapa saja,kita semua dapat bersenang -senang wanita malam yang bisa bergabung dengan siapa saja,"['kita', 'semua', 'dapat', 'bersenang', '-senang', 'wanita', 'malam', 'yang', 'bisa', 'bergabung', 'dengan', 'siapa', 'saja']","['bersenang', '-senang', 'wanita', 'malam', 'bergabung']","['senang', '-senang', 'wanita', 'malam', 'gabung']",Not Suicide post
"tebak siapa yang akan mati hari ini itu adalah saya, saya terlalu lelah dengan semuanya dan saya terlalu terluka","tebak siapa yang akan meninggal hari ini itu adalah saya, saya terlalu lelah dengan semuanya dan saya terlalu terluka","['tebak', 'siapa', 'yang', 'akan', 'meninggal', 'hari', 'ini', 'itu', 'adalah', 'saya', ',', 'saya', 'terlalu', 'lelah', 'dengan', 'semuanya', 'dan', 'saya', 'terlalu', 'terluka']","['tebak', 'meninggal', ',', 'lelah', 'terluka']","['tebak', 'tinggal', '', 'lelah', 'luka']",Potential Suicide post
aku hanya ingin memunculkan mac tidak mati karena kokain yang dicampur dengan fentanyl dia benar -benar memiliki garis omong kosong dan,saya hanya ingin memunculkan mac tidak meninggal karena kokain yang dicampur dengan fentanyl dia benar -benar memiliki garis omong kosong dan,"['saya', 'hanya', 'ingin', 'memunculkan', 'mac', 'tidak', 'meninggal', 'karena', 'kokain', 'yang', 'dicampur', 'dengan', 'fentanyl', 'dia', 'benar', '-benar', 'memiliki', 'garis', 'omong', 'kosong', 'dan']","['memunculkan', 'mac', 'meninggal', 'kokain', 'dicampur', 'fentanyl', '-benar', 'memiliki', 'garis', 'omong', 'kosong']","['muncul', 'mac', 'tinggal', 'kokain', 'campur', 'fentanyl', '-benar', 'milik', 'garis', 'omong', 'kosong']",Potential Suicide post
menonton tron ​​oh my genius stuff d adegan sepeda baru saja flash,menonton tron ​​oh my genius stuff d adegan sepeda baru saja flash,"['menonton', 'tron', '\u200b\u200boh', 'my', 'genius', 'stuff', 'd', 'adegan', 'sepeda', 'baru', 'saja', 'flash']","['menonton', 'tron', '\u200b\u200boh', 'my', 'genius', 'stuff', 'd', 'adegan', 'sepeda', 'flash']","['tonton', 'tron', 'oh', 'my', 'genius', 'stuff', 'd', 'adegan', 'sepeda', 'flash']",Not Suicide post
memiliki puff gula untuk sarapan dan mendengarkan mcfly sungguh cara yang bagus untuk memulai hari saya,memiliki puff gula untuk sarapan dan mendengarkan mcfly sungguh cara yang bagus untuk memulai hari saya,"['memiliki', 'puff', 'gula', 'untuk', 'sarapan', 'dan', 'mendengarkan', 'mcfly', 'sungguh', 'cara', 'yang', 'bagus', 'untuk', 'memulai', 'hari', 'saya']","['memiliki', 'puff', 'gula', 'sarapan', 'mendengarkan', 'mcfly', 'sungguh', 'bagus']","['milik', 'puff', 'gula', 'sarap', 'dengar', 'mcfly', 'sungguh', 'bagus']",Not Suicide post
memiliki 100 slide lagi,memiliki 100 slide lagi,"['memiliki', '100', 'slide', 'lagi']","['memiliki', '100', 'slide']","['milik', '100', 'slide']",Not Suicide post
"newfoundland canada rt saya ingin mengatakan saya tidak akan pernah aktif lagi tidak yakin saya tidak punya alasan untuk berada di sini lagi, selamat tinggal semuanya","newfoundland canada rt saya ingin mengatakan saya tidak akan pernah aktif lagi tidak yakin saya tidak punya alasan untuk berada di sini lagi, selamat tinggal semuanya","['newfoundland', 'canada', 'rt', 'saya', 'ingin', 'mengatakan', 'saya', 'tidak', 'akan', 'pernah', 'aktif', 'lagi', 'tidak', 'yakin', 'saya', 'tidak', 'punya', 'alasan', 'untuk', 'berada', 'di', 'sini', 'lagi', ',', 'selamat', 'tinggal', 'semuanya']","['newfoundland', 'canada', 'rt', 'aktif', 'alasan', ',', 'selamat', 'tinggal']","['newfoundland', 'canada', 'rt', 'aktif', 'alas', '', 'selamat', 'tinggal']",Potential Suicide post
kami buka lagi hari ini mulai jam 10 pagi sampai jam 7 malam masuk dan melihat kami,kami buka lagi hari ini mulai jam 10 pagi sampai jam 7 malam masuk dan melihat kami,"['kami', 'buka', 'lagi', 'hari', 'ini', 'mulai', 'jam', '10', 'pagi', 'sampai', 'jam', '7', 'malam', 'masuk', 'dan', 'melihat', 'kami']","['buka', 'jam', '10', 'pagi', 'jam', '7', 'malam', 'masuk']","['buka', 'jam', '10', 'pagi', 'jam', '7', 'malam', 'masuk']",Not Suicide post
maaf saya terus melewatkan u kd u tidak perlu apoligise karena tidak ada yang kita semua mengalami hari -hari buruk dan apa yang kamu berurusan,maaf saya terus melewatkan kamu kd kamu tidak perlu apoligise karena tidak ada yang kita semua mengalami hari -hari buruk dan apa yang kamu berurusan,"['maaf', 'saya', 'terus', 'melewatkan', 'kamu', 'kd', 'kamu', 'tidak', 'perlu', 'apoligise', 'karena', 'tidak', 'ada', 'yang', 'kita', 'semua', 'mengalami', 'hari', '-hari', 'buruk', 'dan', 'apa', 'yang', 'kamu', 'berurusan']","['maaf', 'melewatkan', 'kd', 'apoligise', 'mengalami', '-hari', 'buruk', 'berurusan']","['maaf', 'lewat', 'kd', 'apoligise', 'alami', '-hari', 'buruk', 'urus']",Potential Suicide post
memberkati ya kawan,memberkati ya kawan,"['memberkati', 'ya', 'kawan']","['memberkati', 'ya', 'kawan']","['kati', 'ya', 'kawan']",Not Suicide post
rt saya tidak pernah mengatakan hidup saya sangat menyedihkan hidup saya cukup baik tidak akan berbohong tetapi apa yang tampaknya menjadi kehidupan istimewa mungkin n,rt saya tidak pernah mengatakan hidup saya sangat menyedihkan hidup saya cukup baik tidak akan berbohong tetapi apa yang tampaknya menjadi kehidupan istimewa mungkin n,"['rt', 'saya', 'tidak', 'pernah', 'mengatakan', 'hidup', 'saya', 'sangat', 'menyedihkan', 'hidup', 'saya', 'cukup', 'baik', 'tidak', 'akan', 'berbohong', 'tetapi', 'apa', 'yang', 'tampaknya', 'menjadi', 'kehidupan', 'istimewa', 'mungkin', 'n']","['rt', 'hidup', 'menyedihkan', 'hidup', 'berbohong', 'kehidupan', 'istimewa', 'n']","['rt', 'hidup', 'sedih', 'hidup', 'bohong', 'hidup', 'istimewa', 'n']",Potential Suicide post
"rute yang bagus di sini adalah hari ini, naik 2 putaran","rute yang bagus di sini adalah hari ini, naik 2 putaran","['rute', 'yang', 'bagus', 'di', 'sini', 'adalah', 'hari', 'ini', ',', 'naik', '2', 'putaran']","['rute', 'bagus', ',', '2', 'putaran']","['rute', 'bagus', '', '2', 'putar']",Not Suicide post
ini menyakitkan dan hanya pemikiran kehilangan orang muda lain karena bunuh diri membuatnya sangat sulit untuk melihat keluarga,ini menyakitkan dan hanya pemikiran kehilangan orang muda lain karena bunuh diri diri membuatnya sangat sulit untuk melihat keluarga,"['ini', 'menyakitkan', 'dan', 'hanya', 'pemikiran', 'kehilangan', 'orang', 'muda', 'lain', 'karena', 'bunuh', 'diri', 'diri', 'membuatnya', 'sangat', 'sulit', 'untuk', 'melihat', 'keluarga']","['menyakitkan', 'pemikiran', 'kehilangan', 'orang', 'muda', 'bunuh', 'membuatnya', 'sulit', 'keluarga']","['sakit', 'pikir', 'hilang', 'orang', 'muda', 'bunuh', 'buat', 'sulit', 'keluarga']",Potential Suicide post
aku mencintaimu di chelsea belakangan ini,saya mencintaimu di chelsea belakangan ini,"['saya', 'mencintaimu', 'di', 'chelsea', 'belakangan', 'ini']","['mencintaimu', 'chelsea']","['cinta', 'chelsea']",Not Suicide post
moody woods benar -benar luar biasa,moody woods benar -benar luar biasa,"['moody', 'woods', 'benar', '-benar', 'luar', 'biasa']","['moody', 'woods', '-benar']","['moody', 'woods', '-benar']",Not Suicide post
"karena kita berbicara tentang dia, hei uhh ingat ketika yanderedev mengatakan orang cacat intelektual layak untuk mati p","karena kita berbicara tentang dia, hei uhh ingat ketika yanderedev mengatakan orang cacat intelektual layak untuk meninggal p","['karena', 'kita', 'berbicara', 'tentang', 'dia', ',', 'hei', 'uhh', 'ingat', 'ketika', 'yanderedev', 'mengatakan', 'orang', 'cacat', 'intelektual', 'layak', 'untuk', 'meninggal', 'p']","['berbicara', ',', 'hei', 'uhh', 'yanderedev', 'orang', 'cacat', 'intelektual', 'layak', 'meninggal', 'p']","['bicara', '', 'hei', 'uhh', 'yanderedev', 'orang', 'cacat', 'intelektual', 'layak', 'tinggal', 'p']",Potential Suicide post
oh itu bagus terima kasih saya akan melewatinya,oh itu bagus terima kasih saya akan melewatinya,"['oh', 'itu', 'bagus', 'terima', 'kasih', 'saya', 'akan', 'melewatinya']","['oh', 'bagus', 'terima', 'kasih', 'melewatinya']","['oh', 'bagus', 'terima', 'kasih', 'lewat']",Not Suicide post
omg serius mengapa tidak sial saya mendapatkan hari kamis dari apa yang anda ingin lakukan saya mendapat balasan anda,ya tuhan serius mengapa tidak sial saya mendapatkan hari kamis dari apa yang anda ingin lakukan saya mendapat balasan anda,"['ya', 'tuhan', 'serius', 'mengapa', 'tidak', 'sial', 'saya', 'mendapatkan', 'hari', 'kamis', 'dari', 'apa', 'yang', 'anda', 'ingin', 'lakukan', 'saya', 'mendapat', 'balasan', 'anda']","['ya', 'tuhan', 'serius', 'sial', 'kamis', 'lakukan', 'balasan']","['ya', 'tuhan', 'serius', 'sial', 'kamis', 'laku', 'balas']",Not Suicide post
"anda adalah anak ipar yang begitu manis, saya harap ini berjalan dengan baik hari ini","anda adalah anak ipar yang begitu manis, saya harap ini berjalan dengan baik hari ini","['anda', 'adalah', 'anak', 'ipar', 'yang', 'begitu', 'manis', ',', 'saya', 'harap', 'ini', 'berjalan', 'dengan', 'baik', 'hari', 'ini']","['anak', 'ipar', 'manis', ',', 'harap', 'berjalan']","['anak', 'ipar', 'manis', '', 'harap', 'jalan']",Not Suicide post
